{
    "$schema": "https://json-schema.org/draft/2020-12/schema",
    "title": "Burdah Fasl Schema",
    "version": "1.1",
    "type": "object",
    "properties": {
        "number": {
            "type": "integer",
            "description": "The chapter number."
        },
        "source": {
            "type": "string",
            "description": "The source of the text."
        },
        "name": {
            "type": "string",
            "description": "The Arabic name of the fasl (chapter)."
        },
        "latin": {
            "type": [
                "string",
                "null"
            ],
            "description": "The transliteration of the chapter name."
        },
        "text": {
            "type": "object",
            "description": "Contains the Arabic text and its transliteration.",
            "patternProperties": {
                "^[0-9]+$": {
                    "type": "object",
                    "properties": {
                        "arabic": {
                            "type": "string",
                            "description": "The Arabic text of the verse."
                        },
                        "latin": {
                            "type": [
                                "string",
                                "null"
                            ],
                            "description": "The transliteration of the Arabic text."
                        }
                    },
                    "required": [
                        "arabic"
                    ],
                    "additionalProperties": false
                }
            },
            "additionalProperties": false
        },
        "translations": {
            "type": [
                "object",
                "null"
            ],
            "description": "Translations in various languages.",
            "patternProperties": {
                "^[a-z]{2}$": {
                    "type": "object",
                    "description": "The key representing the language code using a two-letter ISO 639-1 code (e.g., 'en' for English, 'ar' for Arabic).",
                    "properties": {
                        "name": {
                            "type": "string",
                            "description": "The translated name of the chapter in the specified language."
                        },
                        "muqaddimah": {
                            "type": "string",
                            "description": "(introduction) of the chapter."
                        },
                        "translator": {
                            "type": "string",
                            "description": "translator of the chapter."
                        },
                        "text": {
                            "type": "object",
                            "description": "Translated text for each verse in the specified language.",
                            "patternProperties": {
                                "^[0-9]+$": {
                                    "type": "string",
                                    "description": "Translated text of the verse in the specified language."
                                }
                            },
                            "additionalProperties": false
                        }
                    },
                    "required": [
                        "name",
                        "text"
                    ],
                    "additionalProperties": false
                }
            },
            "additionalProperties": false
        },
        "last_updated": {
            "type": "string",
            "format": "date",
            "pattern": "^(\\d{4})-(\\d{2})-(\\d{2})$",
            "description": "The date when the data was last updated, in ISO 8601 date format (e.g., '2024-11-09')."
        }
    },
    "required": [
        "number",
        "source",
        "name",
        "last_updated"
    ],
    "anyOf": [
        {
            "required": [
                "text"
            ]
        },
        {
            "required": [
                "translations"
            ]
        }
    ],
    "additionalProperties": false
}