{
    "number": 9,
    "source": "dalail-khairat",
    "name": "الْفَصْلُ التَّاسِعُ فِي تَوَسُّلِ بِرَسُولِ اللهِ ﷺ",
    "latin": null,
    "text": {
        "1": {
            "arabic": "خَدَمْتُهُ بِمَدِيحٍ أَسْتَقِيلُ بِهِ۞ذُنُوبَ عُمْرٍ مَضَى فِي الشِّعْرِ وَالخِدَمِ",
            "latin": "Khadamtuhu bi madīḥin astaqīlu bihi۞Dhunūba ʿumrin maḍā fish shiʿri wal khidami"
        },
        "2": {
            "arabic": "إِذْ قَلَّدَانِيَ مَا تُخْشَى عَوَاقِبُهُ۞كَأَنَّنِي بِهِمَا هَدْىٌ مِنَ النَّعَمِ",
            "latin": "Idh qalladāniya mā tukhshā ʿawāqibuhu۞Ka annanī bihimā hadyun minan naʿami"
        },
        "3": {
            "arabic": "أَطَعْتُ غَيَّ الصِّبَا فِي الحَالَتَيْنِ وَمَا۞حَصَلْتُ إِلاَّ عَلَى الآثَامِ وَالنَّدَمِ",
            "latin": "Aṭaʿtu ghayyaṣ ṣibā fīl ḥālatayni wa mā۞Ḥaṣaltu illā ʿalal āthāmi wan nadami"
        },
        "4": {
            "arabic": "فَيَا خَسَارَةَ نَفْسٍ فِي تِجَارَتِهَا۞لَمْ تَشْتَرِ الدِّينَ بِالدُّنْيَا وَلَمْ تَسُمِ",
            "latin": "Fayā khasārata nafsin fī tijāratihā۞Lam tashtarid dīna bid dunyā wal lam tasumi"
        },
        "5": {
            "arabic": "وَمَنْ يَبِعْ آجِلاً مِنْهُ بِعَاجِلِهِ۞يَبِنْ لَهُ الْغَبْنُ فِي بَيْعٍ وَفِي سَلَمِ",
            "latin": "Wa man yabiʿ ājilan minhu bi ʿājilihi۞Yabin lahul ghabnu fī bayʿin wa fī salami"
        },
        "6": {
            "arabic": "إِنْ آتِ ذَنْبًا فَمَا عَهْدِي بِمُنْتَقِضٍ۞مَنَ النَّبِيِّ وَلاَ حَبْلِي بِمُنْصَرِمِ",
            "latin": "In āti dhanban famā ʿahdī bimuntaqiḍin۞Minan nabiyyi wa lā ḥablī bimunṣarimi"
        },
        "7": {
            "arabic": "فَإِنَّ لِي ذِمَّةً مِنْهُ بِتَسْمِيَتيِ۞مُحَمَّداً وَهْوَ أَوْفَى الخَلْقِ بِالذِّمَمِ",
            "latin": "Fa inna lī dhimmatan minhu bi tasmiyatī۞Muḥammadan wa huwa awfāl khalqi bidh dhimami"
        },
        "8": {
            "arabic": "إِنْ لَمْ يَكُنْ فِي مَعَادِي آخِذًا بِيَدِي۞فَضْلاً وَإِلاَّ فَقُلْ يَا زَلَّةَ القَدَمِ",
            "latin": "In lam yakun fī maʿādī ākhidhan bi yadī۞Faḍlan wa illā faqul yā zallatal qadami"
        },
        "9": {
            "arabic": "حَاشَاهُ أَنْ يَحْرِمَ الرَّاجِي مَكَارِمَهُ۞أَوْ يَرْجِعَ الجَارُ مِنْهُ غَيْرَ مُحْتَرَمِ",
            "latin": "Ḥāshāhu an yaḥrimar rājī makārimahu۞Aw yarjiʿal jāru minhu ghayra muḥtarami"
        },
        "10": {
            "arabic": "وَمُنْذُ أَلْزَمْتُ أَفْكَارِي مَدَائِحَهُ۞وَجَدْتُهُ لِخَلاَصِي خَيْرَ مُلْتَزِمِ",
            "latin": "Wa mundhu alzamtu afkārī madāʾiḥahu۞Wajadtuhu likhalāṣī khayra multazimi"
        },
        "11": {
            "arabic": "وَلَنْ يَفُوتَ الغِنَى مِنْهُ يَدًا تَرِبَتْ۞إِنَّ الحَيَا يُنْبِتَ الأَزْهَارَ فِي الأَكَمِ",
            "latin": "Wa lan yafūtal ghinā minhu yadan taribat۞Innal ḥayā yunbitul azhāra fīl akami"
        },
        "12": {
            "arabic": "وَلَمْ أُرِدْ زَهْرَةَ الدُّنْيَا الَّتيِ اقْتَطَفَتْ۞يَدَا زُهَيْرٍ بِمَا أَثْنَى عَلَى هَرِمِ",
            "latin": "Wa lam urid zahratad dunyal latiqtaṭafat۞Yadā zuhayrin bimā athnā ʿalā harimi"
        }
    },
    "translations": {
        "en": {
            "name": "Chapter Nine: Seeking Intercession through the Prophet ﷺ",
            "text": {
                "1": "By this eulogy I have served him, seeking absolutionFor the sins of a life spent in poetry and patronage.",
                "2": "For these two have yoked me, with consequences I fear;as if I were, on their account, a ritual lamb for slaughter.",
                "3": "In both I obeyed the reckless folly of youth,And gained nothing except sins and regrets.",
                "4": "Alas, what abject loss for a soul in its transaction!It did not buy the Next World at the price of this – or even try to!",
                "5": "Anyone who sells the Hereafter for the ephemeralWill be cheated in their present and future transactions.",
                "6": "I have sinned, yet my pledge to the Prophet is unbroken;Nor has the rope binding me to him been severed.",
                "7": "For I have a protective covenant with him owing to my name—Muḥammad—and he is the most loyal of mankind to covenants.",
                "8": "If, in the Hereafter, he does not take me by the handFrom pure grace, what a terrible slip of the foot!",
                "9": "Far be it for him to deprive one hopeful of his generous gifts,Or for a neighbour to turn back without being honoured by him!",
                "10": "Ever since I have focused my thoughts on his praises,I have found him the one most committed to my salvation.",
                "11": "His wealth will not overlook a dusty, needy hand;For showers cause flowers to bloom on hill-tops.",
                "12": "I sought not the flowers of this worldWhich Zuhayr picked for his praise of Harim."
            }
        },
        "id": {
            "name": "",
            "text": {
                "1": "Aku mengabdikan diri kepada Baginda Nabi ﷺ dengan gubahan syair pujian, yang dengan berkahnya aku mengharapampunan Allah atas dosa-dosaku yang lampau dalam bersyair dan melayani pejabat.",
                "2": "Bersyair dan melayani pejabat menjeratku dengan sesuatu yang akibatnya mengkhawatirkan.Dengan sebab itu, seakan-akan aku adalah hewan sembelihan yang dijerat dengan tali.",
                "3": "Kutaati rayuan masa muda dalam bersyair dan mengabdi ke pejabat.Kini aku tak dapatkan sesuatu kecuali dosa dan penyesalan.",
                "4": "Betapa ruginya jiwaku dalam perniagaan iniapabila tidak membeli agama dengan dunia, juga tak pernah menawarnya.",
                "5": "Barang siapa menjual pahala akhirat dengan gemerlap dunia,maka kerugiannya sungguh nyata. Baik dalam jual beli maupun akad salam.",
                "6": "Jikalau aku kembali melakukan dosa, janji imanku pada Baginda Nabi ﷺ takkan terlepas. Begitu pula tali hubunganku dengan beliau takkan terputus.",
                "7": "Sesungguhnya, aku memiliki jaminan dari Baginda Nabi ﷺ dengan namaku'Muhammad'. Baginda Nabi ﷺ adalah makhluk paling setia dalam memenuhi janji.",
                "8": "Jikalau kelak di akhirat Baginda Nabi ﷺ tak menganugerahiku dengan uluran tanganpertolongan beliau, sungguh tergelincirlah kakiku dalam api neraka.",
                "9": "Tidak mungkin Baginda Nabi ﷺ menolak memberi anugerah kepada orang yang telah mengharapkan.Tak mungkin pula tetangga Baginda Nabi ﷺ kembali dari rumah beliau dalam keadaan tak mulia.",
                "10": "Semenjak kupusatkan segenap fikiranku untuk memuji beliau,kudapati Baginda Nabi g adalah sebaik-baiknya pemberi jaminan untuk keselamatanku.",
                "11": "Tangan seorang fakir yang membutuhkan tak akan luput dari pemberian Baginda Nabi ﷺ.Sungguh, pemberian beliau bagaikan hujan yang akan menumbuhkan bunga-bunga di bukit tinggi.",
                "12": "Aku memuji Baginda Nabi ﷺ bukan ingin menuai kenikmatan dunia sebagaimanaZuhair memetik dunia dengan kedua tangannya sebagai imbalan dari puji-pujian kepada raja Harim bin Sinan."
            }
        }
    },
    "last_updated": "2024-12-11"
}
