{
    "number": 7,
    "source": "minhaj-ul-quran",
    "name": "",
    "latin": null,
    "text": {
        "1": {
            "arabic": "賷賻賭丕 禺賻賷賿乇賻 賲賻賳賿 賷賾賻賲賾賻賲賻 丕賱賿毓賻賭丕賮購賵賿賳賻 爻賻賭丕丨賻鬲賻賴購蹫爻賻毓賿賷賭賸賭丕 賵賾賻賮賻賵賿賯賻 賲購鬲購賵賿賳賽 丕賱兀賻賷賿賳購賯賽 丕賱乇賾購爻購賭賲賽"
        },
        "2": {
            "arabic": "賵賻賲賻賳賿 賴購賭賭賵賻 丕賱丌賷賭賻丞購 丕賱賿賰購亘賿乇賻賶 賱賽賲購毓賿鬲賻亘賽賭乇賺蹫賵賻賲賻賳賿 賴購賭賵賻 丕賱賳賾賽毓賿賲賻賭賭丞購 丕賱賿毓購馗賿賲侔賶 賱賽賲購睾賿鬲賻賳賽賲賽"
        },
        "3": {
            "arabic": "爻賻乇賻賷賿鬲賻 賲賽賳賿 丨賻賭乇賻賲賺 賱賾賻賷賿賭賭賱丕賸 廿賽賽賱賶侔 丨賻乇賻賲賽蹫賰賻賲賻丕 爻賻賭乇賻賶 丕賱賿亘賻丿賿乇購 賮賽賷賿 丿賻丕噩賺 賲賾賽賳賻 丕賱馗賾購賱賻賲賽"
        },
        "4": {
            "arabic": "賵賻亘賽鬲賾賻 鬲賻乇賿賯侔賶 廿賽賽賱賶侔 兀賻賳賿 賳賽賱賿賭鬲賻 賲賻賳賿夭賽賱賻賭賭丞賸蹫賲賽賳賿 賯賻丕亘賻 賯賻賵賿爻賻賭賷賿賳賽 賱賻賲賿 鬲購丿賿乇賻賰賿 賵賻賱賻賻賿賲 鬲購賭乇賻賲賽"
        },
        "5": {
            "arabic": "賵賯賻賭丿賾賻賲賻鬲賿賰賻 噩賻賲賽賷賿毓購 丕賱兀賳賿亘賽賷賻賭丕亍賽 亘賽賴賻賭賭賭丕蹫賵賻丕賱乇賾購爻賿賭賱賽 鬲賻賯賿丿賽賷賿賲賻 賲賻禺賿賭丿購賵賿賲賺 毓賻賱賶侔 禺賻賭丿賻賲賽"
        },
        "6": {
            "arabic": "賵賻兀賻賳賿鬲賻 鬲賻禺賿鬲賻乇賽賯購 丕賱爻賾賻賭賭亘賿毓賻 丕賱胤賾賽亘賻丕賯賻 亘賽賴賽賲賿蹫賮賽賷賿 賲賻賵賿賰賽亘賺 賰購賳賿鬲賻 賮賽賷賿賭賴賽 氐賻丕丨賽亘賻 丕賱賿毓賻賭賱賻賲賽"
        },
        "7": {
            "arabic": "丨賻鬲賶賾侔 廿賽賽匕賻丕 賱賻賲賿 鬲賻丿賻毓賿 卮賻賭賭兀賿賵賸丕 賱賾賽賲購爻賿賭賭鬲賻亘賽賯賺蹫賲賽賳賻 丕賱賭賭賭丿賾購賳購賵賾賽 賵賻賱丕 賲賻乇賿賯賶賸 賱賾賽賲購爻賿賭賭鬲賻賳賽賲賽"
        },
        "8": {
            "arabic": "禺賻賮賻囟賿鬲賻 賰購賭賭賱賾賻 賲賻賯賻丕賲賺賲 亘賽丕賱廿賽賽囟賻賭丕賮賻丞賽 廿賽賽匕賿蹫賳購賵賿丿賽賷賿鬲賻 亘賽丕賱賭乇賾賻賮賿毓賽 賲賽孬賿賱賻 丕賱賿賲購賮賿乇賻丿賽 丕賱賿毓賻賭賭賱賻賲賽"
        },
        "9": {
            "arabic": "賰賻賷賿賲賻丕 鬲賻賮購賵賿夭賻 亘賽賵賻氐賿賭賭賱賺 兀賷賾賽 賲購爻賿賭賭鬲賻鬲賽乇賽蹫毓賻賳賽 丕賱賿毓購賷購賭賭賵賿賳賽 賵賻爻賽賭賭賭乇賾賺 兀賷賾賽 賲購賰賿鬲賻鬲賽賲賽"
        },
        "10": {
            "arabic": "賮賻丨購夭賿鬲賻 賰購賭賭賱賾賻 賮賻禺賻丕乇賺 睾賻賷賿乇賻 賲購卮賿賭鬲賻乇賻賰賺蹫賵賻噩購夭賿鬲賻 賰購賭賭賱賾賻 賲賻賯賻賭賭丕賲賺 睾賻賷賿乇賻 賲購夭賿丿賻丨賻賲賽"
        },
        "11": {
            "arabic": "賵賻噩賻賭賱賾賻 賲賽賯賿賭丿賻丕乇購 賲賻賭丕 賵購賱賾賽賷賿鬲賻 賲賽賳賿 乇賾購鬲賻亘賺蹫賵賻毓賻夭賾賻 廿賽賽丿賿乇賻丕賰購 賲賻賭賭丕 兀購賵賿賱賽賷賿鬲賻 賲賽賳賿 賳賽賾毓賻賭賭賲賽"
        },
        "12": {
            "arabic": "亘購卮賿賭乇侔賶 賱賻賳賻丕 賲賻毓賿卮賻賭乇賻 丕賱廿賽賽爻賿賭賱丕賲賽 廿賽賽賳賾賻 賱賻賳賻丕蹫賲賽賳賻 丕賱賿毓賽賳賻丕賷賻賭丞賽 乇購賰賿賳賭賭丕賸 睾賻賷賿乇賻 賲購賳賿賴賻賭賭丿賽賲賽"
        },
        "13": {
            "arabic": "賱賻賲賾賻賭丕 丿賻毓賻賶 丕賱賱賴 丿賻丕毓賽賷賿賳賭賻賭丕 賱賽胤賻賭賭丕毓賻鬲賽賴賽蹫亘賽賭兀賻賰賿乇賻賲賽 丕賱乇賾購爻賿賱賽 賰購賳賾賻賭丕 兀賻賰賿賭乇賻賲賻 丕賱兀購賲賻賭賲賽"
        }
    },
    "translations": {
        "en": {
            "name": "Section Seven",
            "muqaddimah": " In this section, Hadhrat Imaam Saalih Sharaf-ud-Deen Abu Abdullah Muhammad Bin Hasan Al-Busiri 乇丨賲丞 丕賱賱賴 毓賱賷賴 has described about the Mi鈥檙aj of Rasoolullah A. In the previous sections, he 乇丨賲丞 丕賱賱賴 毓賱賷賴 has spoken about the birth of Rasoolullah A, miracle of the Holy Qur鈥檃n, blessedness of the invitation to Islam and the praises of Rasoolullah A. In this section, he 乇丨賲丞 丕賱賱賴 毓賱賷賴 narrates about the invitation of Nabi Akram A toward Allah Almighty. He 乇丨賲丞 丕賱賱賴 毓賱賷賴 also describes about the heavens, angels and Allah鈥檚 Holy Prophets 毓賱賷賴賲 丕賱爻賱丕賲 who met Rasoolullah A in the night of Mi鈥檙aj. ",
            "text": {
                "1": "(O Prophet!)You are the best of those to whose court the seekers of bounties approach (and they come towards you for the fulfillment of their desires; they are) running (in such a state that they are) mounted on the backs of fast camels.",
                "2": "And O (Holy Prophet!) you are the greatest sign for whom who takes lesson; and O (Prophet!) you are (the one) who is the greatest bounty for a person who gets (opportunity) to take something of it.",
                "3": "(O Prophet!)You traveled over night from one sacred place (Haram Mosque) to another (Aqsa Mosque, same) as the full moon travels (at night) through intense darkness.",
                "4": "And (O Prophet!) you continued ascending (over night) until you reached (your) destination (which is) Qaaba Qausain (the distance of two cubits length) which is never been attained nor sought (by any other prophet).",
                "5": "And (O Prophet!) you were preferred (to lead other prophets毓賱賷賴賲 丕賱爻賱丕賲 in prayer), due to your (high) position, by all prophets and messengers (毓賱賷賴賲 丕賱爻賱丕賲 just as a) preference given by (a) servant to (his) master.",
                "6": "And (O Prophet!) you passed the seven heavens with them (prophets 毓賱賷賴賲 丕賱爻賱丕賲, while they were in your way and met you; and you continued your journey) in (such) a procession (of angels and prophets 毓賱賷賴賲 丕賱爻賱丕賲) in which you were the leader (of them).",
                "7": "(O Prophet! You continued your journey in the night of Mi鈥檙aj) until you did not leave (any) goal (for) any competitor (to strive for it) in (being) close nor (did you leave) any room for advancer.",
                "8": "(O Prophet!)You made every position (of prophets 毓賱賷賴賲 丕賱爻賱丕賲) inferior by (your) advance, when you were invited (by Allah Almighty) to (His) Majestic and Unique position.",
                "9": "(O Allah鈥檚 Messenger! You were invited) so that you might succeed in reaching (which is) the most concealed from all eyes; and (you might succeed in attaining the) secrets (which are) well concealed.",
                "10": "So (Ya Rasoolallah) you got everything worthy of pride (which is not) rivaled; and you outshined every position which was not crowded (none of others could pass).",
                "11": "And (Ya Rasoolallah) you are bestowed extremely excellent ranks (status); and the bounties which (are) granted to you, are not understandable.",
                "12": "(O) People of Islam! Glad tidings be to (all of) us that we have (been bestowed) by the Grace (of Allah Almighty, such a) pillar (which) will never be destroyed.",
                "13": "When Allah (Almighty) called (Muhammad A) who invited us to His worship (who is) the noblest of messengers, (so being noblest) we are the noblest of Ummats."
            }
        }
    },
    "last_updated": "2024-11-22"
}
