{
    "number": 2,
    "source": "nu-online",
    "name": "الفصل الثاني: في التحذير من هوى النفس",
    "latin": "",
    "text": {
        "1": {
            "arabic": "فَإِنَّ أَمَّـــارَتِيْ بِالسُّـوْءِ مَــــا اتَّعَظَتْ ۞ مِنْ جَهْلِهَا بِنَذِيْرِ الشَّيْبِ وَالْهَرَمِ",
            "latin": "Fainna ammâratî bis-sû'i mât ta‘adhat ۞ min jahlihâ binadzirisy-syaibi wal-harami"
        },
        "2": {
            "arabic": "وَلَا أَعَدَّتْ مِنَ الفِعْلِ الْجَمِيْلِ قِرَى ۞ ضَيْفٍ أَلَمَّ بِرَأْسِيْ غَيْرَ مُحْـــتَشِمِ",
            "latin": "Walâ a‘addat minal-fi‘lil-jamîli qirâ ۞ dlaifin alamma bira'sî ghaira muḫtasyimi"
        },
        "3": {
            "arabic": "لَوْ كُنْتُ أَعْلَــــمُ أَنِّي مَــا أُوَقِّــــــرُهُ ۞ كَتَمْتُ سِرًّا بَدَا لِيْ مَنْهُ بِالْكَـــتَمِ",
            "latin": "Lau kuntu a‘lamu annî mâ uwaqqiruhu ۞ katamtu sirran badâ lî manhu bil-katami"
        },
        "4": {
            "arabic": "مَنْ لِي بِرَدِّ جِمَـــاحٍ مِنْ غَوَايَتِهَـــا ۞ كَمَا يُرَدُّ جِمَـــاحُ الْخَيْلِ بِاللُّجُمِ",
            "latin": "Man lî biraddi jimâḫin min ghawâyatihâ ۞ kamâ yuraddu jimâḫul-khaili bil-lujumi"
        },
        "5": {
            "arabic": "فَلَا تَرُمْ بِالْمَعَاصِيْ كَسْرَ شَهْوَتِهَا ۞ إِنَّ الطَّعَـــامَ يُقَوِّيْ شَهْوَةَ النَّهِمِ",
            "latin": "Falâ tarum bil-ma‘âshî kasra syahwatihâ ۞ innath-tha‘âma yuqawwî syahwatan-nahimi"
        },
        "6": {
            "arabic": "وَالنَّفْسُ كَالطِّفْلِ إِنْ تُهْمِلْهُ شَبَّ عَلَى ۞ حُبِّ الرَّضَاعِ وَإِنْ تَفْطِمْهُ يَنْفَطِمِ",
            "latin": "Wan-nafsu kath-thifli in tuhmilhu syabba ‘alâ ۞ ḫubir-radlâ‘i wa in tafthimhu yanfathimi"
        },
        "7": {
            "arabic": "فَاصْرِفْ هَوَاهَا وَحَاذِرْ أَنْ تُوَلِّيَهُ ۞ إِنَّ الْهَوَى مَا تَوَلَّى يُصِمْ أَوْ يَصِمِ",
            "latin": "Fashrif hawâhâ wa ḫâdzir an tuwallîyahu ۞ innal-hawâ mâ tawallâ yushim au yashimi"
        },
        "8": {
            "arabic": "وَرَاعِهَا وَهْيَ فِيْ الأَعْمَالِ سَـــآئِمَةٌ ۞ وَإِنْ هِيَ اسْتَحْلَتِ الْمَرْعَى فَلَا تُسِمِ",
            "latin": "Wa râ‘ihâ wahya fil-a‘mâli sâ’imatun ۞ wa in hiyas-taḫlatil-mar‘â falâ tusimi"
        },
        "9": {
            "arabic": "كَـمْ حَسَّنَتْ لَذَّةً لِلْمَــــــرْءِ قَـــــاتِلَةً ۞ مِنْ حَيْثُ لَمْ يَدْرِ أَنَّ السَُمَّ فِي الدَّسَمِ",
            "latin": "Kam ḫassanat ladzdzatan lilmar`i qâtilatan ۞ min ḫaitsu lam yadri annas-summa fid-dasami"
        },
        "10": {
            "arabic": "وَاخْشَ الدَّسَائِسَ مِنْ جُوْعٍ وَّمِنْ شِبَعٍ ۞ فَرُبَّ مَخْمَصَةٍ شَرٌّ مِنَ التُّخَمِ",
            "latin": "Wakhsyad-dasâ'isa min jû‘i wa min syiba‘in ۞ farubba makhmashatin syarrun minat-tukhami"
        },
        "11": {
            "arabic": "وَاسْتَفْرِغِ الدَّمْعَ مِنْ عَيْنٍ قَدِ امْتَــــلَأَتْ ۞ مِنَ الْمَحَـــارِمِ وَالْزَمْ حِمْيَـــةَ النَّدَمِ",
            "latin": "Wastafrighid-dam‘a min ‘ainin qad-imtala'at ۞ minal-muḫârimi wal-zam ḫimyatan-nadami"
        },
        "12": {
            "arabic": "وَخَالِفِ النَّفْسَ وَالشَّيْطَانَ وَاعْصِهِمَـا ۞ وَإِنْ هُمَا مَحَّضَاكَ النُّصْحَ فَاتَّهِمِ",
            "latin": "Wa khâlifin-nafsa wasy-syaithâna wa‘shihimâ ۞ wa in humâ maḫḫadlâkan-nushḫa fattahimi"
        },
        "13": {
            "arabic": "وَلَا تُطِعْ مِنْهُمَا خَصْمًــــا وَلَاحَكَمًــــا ۞ فَأَنْتَ تَعْرِفُ كَيْدَ الخَصْمِ وَالْحَكَمِ",
            "latin": "Wa lâ tuthi‘ minhumâ khashman wa lâ ḫakaman ۞ fa anta ta‘rifu kaidal-khashmi wal-ḫakami"
        },
        "14": {
            "arabic": "أَسْتَغْفِـــــرُ اللهَ مِنْ قَوْلٍ بِــلَا عَمَـــــلٍ ۞ لَقَدْ نَسَبْتُ بِهِ نَسْلًا لِذِيْ عُقُمِ",
            "latin": "Astaghfirullâha min qaulin bilâ ‘amalin ۞ laqad nasabtu bihi naslan lidzî ‘uqumi"
        },
        "15": {
            "arabic": "أَمَرْتُكَ الْخَــــيْرَ لٰكِنْ مَا ائْتَمَــرْتُ بِهِ ۞ وَمَا اسْتَقَمْتُ فَمَا قَوْلِيْ لَكَ اسْتَقِمِ",
            "latin": "Amartukal-khaira lâkin mâ'tamartu bihi ۞ wa mas-taqamtu famâ qaulî lakas-taqimi"
        },
        "16": {
            "arabic": "وَلَا تَزَوَّدْتُ قَبْــــلَ الْمَوْتِ نَــــــافِـلَةً ۞ ولَمْ أُصَلِّ سِوَى فَرْضٍ وَلَمْ أَصُمِ",
            "latin": "Wa lâ tazawwadtu qablal-mauti nâfilatan ۞ wa lam ushalli siwâ fardlin wa lam ashumi"
        }
    },
    "translations": {
        "id": {
            "name": "Bab II: Peringatan tentang Bahaya Hawa Nafsu",
            "text": {
                "1": "Sungguh nafsu amarahku pada nasihat tak terima, karena berangkat dari ketidaktahuannya. Adanya peringatan berupa uban di kepala dan ketidakberdayaan tubuh akibat umur senja.",
                "2": "Nafsu amarahku tak mampu bersiap-siap diri, dengan mengerjakan amal baik yang bernilai. Untuk menyambut kedatangan tamu yang pasti, tamu yang singgah di kepala nan tiada malu lagi.",
                "3": "Jikalau aku tahu bahwa diriku tak mampu menghormat tamu. Maka lebih baik kusembunyikan diriku dengan cara menyemir uban di kepalaku.",
                "4": "Siapakah gerangan? Sanggup mengendalikan nafsuku dari kesesatan. Sebagaimana kuda liar yang terkendalikan dengan tali kekangan.",
                "5": "Jangan engkau berharap, dapat mematahkan nafsu dengan maksiat. Karena makanan justru bisa perkuat bagi si rakus makanan lezat.",
                "6": "Nafsu bagaikan bayi, bila kaubiarkan akan tetap suka menyusu. Namun bila engkau sapih, maka bayi akan berhenti sendiri.",
                "7": "Maka palingkanlah nafsumu, takutlah jangan sampai ia menguasai-nya. Sesungguhnya nafsu, jikalau berkuasa maka akan membunuhmu dan membuatmu tercela.",
                "8": "Dan gembalakanlah nafsu, karena dalam amal nafsu bagaikan hewan ternak. Jika nafsu merasa nyaman dalam kebaikan, maka tetap jaga dan jangan engkau lengah.",
                "9": "Betapa banyak kelezatan, justru bagi seseorang membawa kematian. Karena tanpa diketahui, adanya racun tersimpan dalam makanan.",
                "10": "Takutlah terhadap tipu dayanya lapar dan kenyang. Sebab sering terjadi rasa lapar lebih daripada kenyang.",
                "11": "Deraikanlah air mata, dari pelupuk mata yang penuh noda dosa. Peliharalah rasa sesal dan kecewa karena dosa.",
                "12": "Lawanlah hawa nafsu dan setan durhaka, dan jagalah pada keduanya. Jika mereka tulus menasihati maka engkau harus mencurigai.",
                "13": "Janganlah engkau taat kepada mereka nafsu dan setan, baik selaku musuh atau selaku hakim. Sebab engkau sudah tahu dengan nyata, bagaimana tipu dayanya dalam musuh dan menghukumi.",
                "14": "Kumohon pengampunan kepada Allah, atas ucapan yang tanpa mengamalkan. Sungguh.. hal itu laksana orang mandul tak berketurunan.",
                "15": "Aku perintahkan engkau lakukan amal kebaikan, namun aku sendiri enggan mengerjakan. Maka tiada berguna ucapanku agar engkau berlaku benar, sedangkan diriku sendiri dalam kelalaian.",
                "16": "Dan diriku tiada menambah amal kebaikan dalam kesunahan, sebelum kematian datang. Dan tiada aku shalat dan puasa, kecuali hanya ibadah yang wajibkan."
            }
            
        }
    },
    "last_updated": "2024-11-10"
}