{
    "number": 4,
    "source": "minhaj-ul-quran",
    "name": "",
    "latin": null,
    "text": {
        "1": {
            "arabic": "兀賻亘賭賻賭丕賳賻 賲賻賵賿賱賽丿購賴購 毓賻賳賿 胤賽賷賿賭賭亘賽 毓購賳賿氐購乇賽賴賽蹫賷賻賭賭賭丕 胤賽賷賿亘賻 賲購亘賿鬲賻賭丿賻廿賺 賲賾賽賳賿賴購 賵賻賲購禺賿鬲賻鬲賻賭賲賽"
        },
        "2": {
            "arabic": "賷賻賭賭賵賿賲賹 鬲賻賮賻乇賾賻爻賻 賮賽賷賿賭賭賴賽 丕賱賿賮購乇賿爻購 兀賻賳賾賻賴購賭賲購蹫賯賻賭賭丿賿 兀購賳賿賭匕賽乇購賵賿丕 亘賽賽丨購賱購賵賿賱賽 丕賱賿亘購丐賿爻賽 賵賻丕賱賳賾賽賯賻賲賽"
        },
        "3": {
            "arabic": "賵賻亘賭賻丕鬲賻 廿賽賽賷賿賵賻丕賳購 賰賽爻賿賭乇侔賶 賵賻賴賿賵賻 賲購賳賿氐賻丿賽毓賹蹫賰賻卮賻賭賲賿賱賽 兀賻氐賿丨賻丕亘賽 賰賽爻賿賭乇侔賶 睾賻賷賿乇賻 賲購賱賿鬲賻卅賽賲賽"
        },
        "4": {
            "arabic": "賵賻丕賱賳賾賻丕乇購 禺賻賭丕賲賽丿賻丞購 丕賿賱兀賻賳賿賮賻賭丕爻賽 賲賽賳賿 兀賻爻賻賭賮賺蹫毓賻賱賻賷賿賴賽 賵賻丕賱賳賾賻賴賿乇購 爻賻賭丕賴賽賷 丕賱賿毓賻賷賿賳賽 賲賽賳賿 爻賻賭丿賻賲賽"
        },
        "5": {
            "arabic": "賵賻爻賻賭丕亍賻 爻賻賭丕賵賻丞賻 兀賻賳賿 睾賻丕囟賻鬲賿 亘購丨賻賷賿乇賻鬲購賴賻賭丕蹫賵賻乇購丿賾賻 賵賻丕乇賽丿購賴賻賭丕 亘賽賭賭丕賱賿睾賻賷賿馗賽 丨賽賷賿賳賻 馗賻賭賲賽賷賿"
        },
        "6": {
            "arabic": "賰賻賭賭兀賻賳賾賻 亘賽丕賱賳賾賻賭丕乇賽 賲賻丕 亘賽丕賱賿賲賻賭丕亍賽 賲賽賳賿 亘賻賱賻賭賱賺蹫丨購夭賿賳賭丕賸 賵賾賻亘賽賭丕賱賿賲賻丕亍賽 賲賻丕 亘賽賭丕賱賳賾賻丕乇賽 賲賽賳賿 囟賻賭乇賻賲賽"
        },
        "7": {
            "arabic": "賵賻丕賱賿噩賽賳賾購 鬲賻賴賿鬲賽賮購 賵賻丕賿賱兀賻賳賿賭賭賵賻丕乇購 爻賻賭賭丕胤賽毓賻丞賹蹫賵賻丕賱賿丨賻賭賯賾購 賷購馗賿賴賻賭乇購 賲賽賳賿 賲賾賻毓賿賳賶賸 賵賾賻賲賽賳賿 賰賻賭賱賽賲賽"
        },
        "8": {
            "arabic": "毓賻賲購賵賿丕 賵賻氐賻賲賾購賵賿丕 賮賻賭賭廿賽賽毓賿賱丕賻賳購 丕賱賿亘賻卮賻賭丕卅賽乇賽 賱賻賲賿蹫鬲購爻賿賲賻毓賿 賵賻亘賭賻賭賭丕乇賽賯賻丞購 丕賿賱廿賽賽賳賿匕賻丕乇賽 賱賻賲賿 鬲購卮賻賭賲賽"
        },
        "9": {
            "arabic": "賲賽賳賿賲 亘賻毓賿賭丿賽 賲賻丕 兀賻禺賿亘賻乇賻 丕賱兀賻賯賿賵賻丕賲賻 賰賻賭賭丕賴賽賳購賴購賲賿蹫亘賽賭賭兀賻賳賾賻 丿賽賷賳賻賭賴購賭賲購 丕賱賿賲購毓賿賭賵賻噩賾賻 賱賻賲賿 賷賻賯購賭賲賽"
        },
        "10": {
            "arabic": "賵賻亘賻毓賿賭丿賻 賲賻丕 毓賻丕賷賻賳購賵賿丕 賮賽賷 丕賱兀購賮購賯賽賽 賲賽賳賿 卮購賭賴購亘賺蹫賲購賳賿賯賻囟賾賻丞賺 賵賾賻賮賿賭賯賻 賲賻賭丕 賮賽賷 丕賱兀乇賿囟賽 賲賽賳賿 氐賻賳賻賲賽"
        },
        "11": {
            "arabic": "丨賻鬲賾侔賶 睾賻賭丿賻丕 毓賻賳賿 胤賻賭乇賽賷賿賯賽 丕賱賿賵賻丨賿賷賽 賲購賳賿賴賻夭賽賲賹蹫賲賽賳賻 丕賱卮賾賻賭賷賻丕胤賽賷賿賳賽 賷賻賯賿賮購購賵賿丕 廿賽賽孬賿賭乇賻 賲購賳賿賴賻賭夭賽賲賽"
        },
        "12": {
            "arabic": "賰賻賭兀賻賳賾賻賴購賲賿 賴賻乇賻亘賭賻賭丕 兀賻亘賿胤賻賭賭丕賱購 兀亘賿乇賻賴賻賭丞賺蹫兀賻賵賿 毓賻爻賿賰賻乇賹 亘賽賭丕賱賿丨賻氐侔賶 賲賽賳賿 乇賾賻丕丨賻鬲賻賷賿賭賴賽 乇購賲賽賷賿"
        },
        "13": {
            "arabic": "賳賻亘賿匕賸丕賲 亘賽賴賽 亘賻毓賿賭丿賻 鬲賻爻賿賭亘賽賷賿丨賺賲 亘賽亘賻賭胤賿賳賽賴賽賲賻賭賭丕蹫賳賻亘賿賭匕賻 丕賱賿賲購爻賻亘賾賽丨賽 賲賽賳賿 兀賻丨賿卮賻賭賭丕亍賽 賲購賱賿鬲賻賯賽賭賲賽"
        }
    },
    "translations": {
        "en": {
            "name": "Section Four",
            "muqaddimah": " In this section, Hadhrat Imaam Saalih Sharaf-ud-Deen Abu Abdullah Muhammad Bin Hasan Al-Busiri 乇丨賲丞 丕賱賱賴 毓賱賷賴 has described about the birth of Rasoolullah A, his Amiracles as well as incidents which took place at the time of his A birth. No doubt, all these are the signs of the greatness of our Prophet Muhammad A. The day of his birth is a blessed day. The birth of Rasoolullah A absolutely lighted up the whole universe. And Rasoolullah A鈥檚 arrival removed all troubles and difficulties from this world. So the birth of Rasoolullah A was great blessing for not only human beings but for all the creations of Allah Almighty.",
            "text": {
                "1": "His place (and time) of birth showed the scent of his pure origin; The Excellence! His birth (and apparently happening) death (both) are scented (and sacred).",
                "2": "On that day, the Persians perceived due to (their) perception that they were going to face a misfortune (and) warned misfortune and punishment (which) approached.",
                "3": "And at night, the walls of the palace of Kisra crumbled (after trembling) as the army of Kisra scattered (and) could not be united again.",
                "4": "And the fire (of the Persians) was extinguished out of regret; and the rivers (of Persia) dried up with wonder (and excessive sorrow).",
                "5": "And (when) the water of river dried up, Saawah (a village in Persia) became grief-stricken; and (thirsty) goer (water bearer) returned in anger with disappointment.",
                "6": "It is as though, due to grief, the fire became (cold) like water, while water (of Buhairah) was (turned into) the blazing fire (of Persia).",
                "7": "And the jinni was announcing (at the appearance of the ProphetA) and the Light (of the Holy ProphetA) was shiny; and the truth (the Prophethood of Muhammad A) appeared with outward and inward qualities (of the Holy Prophet A).",
                "8": "(They, the polytheists) became blind and deaf. Neither did they hear the announcements of glad tidings nor was the lightening of warning seen (by them).",
                "9": "(Inspite of) after their fortune tellers had informed the people (infidels) that their false religion would never stand (but they yet were blind and deaf).",
                "10": "And even after they had seen the stars on the horizon falling, just as (their) idols were (falling) on the earth.",
                "11": "Even the devils kept running from the path of revelation one after the other (at the time of birth of the Holy Prophet A).",
                "12": "As though in running away they (Satans) were the brave army of Abraha (the man who wanted to demolish the house of Allah Almighty with the help of his army of Elephants) or (like that) army on which the pebbles were thrown by his palms.",
                "13": "Which (the pebbles) he (A) threw after their making tasbeeh (praise of Allah Almighty) in his hands, like how (Hadhrat Younus D) who made tasbeeh (of Almighty Allah) was thrown out from the stomach of the (big) swallowing (fish)."
            }
        }
    },
    "last_updated": "2024-11-22"
}
