{
    "number": 10,
    "source": "minhaj-ul-quran",
    "name": "",
    "latin": null,
    "text": {
        "1": {
            "arabic": "賷賻賭丕 兀賻賰賿乇賻賲賻 丕賱賿禺賻賱賿賯賽 賲賻丕 賱賽賷 賲賻賳賿 兀賻賱購賵賿匕購 亘賽賴蹫爻賽賭賵賻丕賰賻 毓賽賳賿賭丿賻 丨購賱購賵賿賱賽 丕賱賿丨賻丕丿賽孬賽 丕賱賿毓賻賲賻賲賽"
        },
        "2": {
            "arabic": "賵賻賱賻賳賿 賷賾賻囟賽賷賿賯賻 乇賻爻購賭賵賿賱賻 丕賱賱賴賽 噩賻丕賴購賰賻 亘賽賷賿蹫廿賽匕賻丕 丕賱賿賰賻乇賽賷賿賲購 鬲賻噩賻賱賾賻賶 亘賽賭賭丕爻賿賲賽 賲購賳賿鬲賻賯賽賭賲賽"
        },
        "3": {
            "arabic": "賮賻廿賽賳賾賻 賲賽賳賿 噩購賵賿丿賽賰賻 丕賱丿賾購賳賿賷賻丕 賵賻囟賻乇賾賻鬲賻賴賻丕蹫賵賻賲賽賳賿 毓購賱購賵賿賲賽賰賻 毓賽賱賿賲購 丕賱賱賾賻賵賿丨賽 賵賻丕賱賿賯賻賱賻賲賽"
        },
        "4": {
            "arabic": "賷賻丕 賳賻賮賿賭爻購 賱丕 鬲賻賯賿賳賻胤賽賷 賲賽賳賿 夭賻賱賾賻丞賺 毓賻馗購賲賻鬲賿蹫廿賽賽賳賾賻 丕賱賿賰賻亘賻賭丕卅賽乇賻 賮賽賷 丕賱賿睾購賮賿乇賻丕賳賽 賰賻賭丕賱賱賾賻賲賻賭賲賽"
        },
        "5": {
            "arabic": "賱賻毓賻賭賱賾賻 乇賻丨賿賲賻丞賻 乇賻亘賾賽賷賿 丨賽賷賿賳賻 賷賻賯賿爻賽賭賭賲購賴賻丕蹫鬲賻兀賿鬲賽賷賿 毓賻賱賶 丨賻爻賻亘賽 丕賱賿毓賽氐賿賷丕賻賳賽 賮賽賷 丕賱賿賯賽爻賻賲賽"
        },
        "6": {
            "arabic": "賷賻丕 乇賻亘賾賽 賵賻丕噩賿毓賻賱賿 乇賻噩賻丕卅賽賷賿 睾賻賷賿乇賻 賲購賳賿毓賻賰賽爻賺蹫賱賻丿賻賷賿賭賰賻 賵賻丕噩賿毓賻賱賿 丨賽爻賻丕亘賽賷賿 睾賻賷賿乇賻 賲購賳賿禺賻乇賽賲賽"
        },
        "7": {
            "arabic": "賵賻丕賱賿胤購賮賿 亘賽毓賻亘賿丿賽賰賻 賮賽賷 丕賱丿賾賻丕乇賻賷賿賳賽 廿賽賽賳賾賻 賱賻賭賴購蹫氐賻亘賿乇丕賸 賲賾賻鬲侔賶 鬲賻賭丿賿毓購賴購 丕賱兀賻賴賿賭賵賻丕賱購 賷賻賳賿賴賻夭賽賲賽"
        },
        "8": {
            "arabic": "賵賻丕卅賿匕賻賳賿 賱賾賽爻購丨賿亘賽 氐賻賱丕丞賺 賲賾賽賳賿賰賻 丿賻丕卅賽賲賻丞賺蹫毓賻賭賱賻賶 丕賱賳賾賻亘賽賷賾賽 亘賽賲購賳賿賴賻賭賭賱賾賺 賵賾賻賲購賳賿爻賻賭噩賽賲賽"
        },
        "9": {
            "arabic": "賵賻丕賱丌賱賽 賵賻丕賱氐賾賻丨賿亘賽 孬購賲賾賻 丕賱鬲賾賻丕亘賽毓賽賷賿賳賻 賮賻賴購賭賲賿蹫兀賻賴賿賱購 丕賱鬲賾購賯侔賶 賵賻丕賱賳賾購賯侔賶 賵賻丕賱賿丨賽賱賿賲賽 賵賻丕賱賿賰賻賭乇賻賲賽"
        },
        "10": {
            "arabic": "孬購賲賾賻 丕賱乇賾賽囟賻賭丕 毓賻賳賿 兀賻亘賽賷賿 亘賻賰賿乇賺 賵賾賻毓賻賳賿 毓購賲賻乇賻蹫賵賻毓賻賳賿 毓賻賱賽賷賾賺 賵賾賻毓賻賳賿 毓購孬賿賲賻賭丕賳賻 匕賽賷 丕賱賿賰賻乇賻賲賽"
        },
        "11": {
            "arabic": "賲賻丕 乇賻賳賾賻丨賻鬲賿 毓賻匕賻亘賻丕鬲賽 丕賱賿亘賻丕賳賽 乇賽賷賿丨購 氐賻亘賻賭丕蹫賵賻兀賻胤賿乇賻亘賻 丕賱賿毓賽賷賿爻賻 丨賻丕丿賽賷 丕賱賿毓賽賷賿爻賽 亘賽丕賱賳賾賻睾賻賲賽"
        },
        "12": {
            "arabic": "賮賻丕睾賿賮賽乇賿 賱賽賳賻丕卮賽丿賽賴丕 賵賻丕睾賿賮賽乇賿 賱賽賯賻丕乇賽卅賽賴賻丕蹫爻賻丕賻賱賿鬲購賰賻 丕賱賿禺賻賷賿乇賻 賷賻丕 匕賻丕 丕賱賿噩購賵賿丿賽 賵賻丕賱賿賰賻乇賻賲賽"
        },
        "13": {
            "arabic": "賷賻丕 乇賻亘賾賽 亘賽丕賱賿賲購氐賿胤賻賮蹖 亘賻丕賱賾賽睾賿 賲賻賯賻丕氐賽丿賻賳賻丕蹫賵賻丕睾賿賮賽乇賿賱賻賳賻丕 賲賻丕賲賻囟蹖 賷賻丕 賵賻丕爻賽毓賻 丕賱賿讴賻乇賻賲賽"
        }
    },
    "translations": {
        "en": {
            "name": "Section Ten",
            "muqaddimah": " In this section Hadhrat Imaam Saalih Sharaf-ud-Deen Abu Abdullah Muhammad Bin Hasan Al-Busiri 乇丨賲丞 丕賱賱賴 毓賱賷賴 seeks refuge through the means of the Holy Prophet A. He 乇丨賲丞 丕賱賱賴 毓賱賷賴 has hope for forgiveness of his sins through the means and intercession of the Holy Prophet A. He recites Durood upon Nabi Akram (A), his family, four Orthodox Caliphs and his Companions y. He 乇丨賲丞 丕賱賱賴 毓賱賷賴 also asks Allah Almighty to forgive the writer of this poem and its reciter. ",
            "text": {
                "1": "The most generous of mankind, I do not have anyone to take shelter in except you at occurrence (at the time) of widespread calamity (last day, general resurrection).",
                "2": "And (O) Messenger of Allah (Almighty)! Because of me, your (highly) exalted status will not reduce. When the most bountiful (Allah Almighty) will show plainly (Himself) by the name of the punisher.",
                "3": "For verily, amongst your bounties is this world and the Hereafter; and the knowledge of Preserved Tablit (Lauh) and the Pen is the part of your knowledge.",
                "4": "My soul! Do not lose heart due to your capital sins. Verily, major sins in (the ocean of) pardon are minor.",
                "5": "(I) hope, the mercy of my Lord, when distributed, would be distributed in proportion (according) to the sins.",
                "6": "O my Lord! Make my hopes fulfilled by You and make not my accounting (calculation of deeds) destructive.",
                "7": "And (O my Lord)! Be kind to Your Servant in both the worlds; for verily, he has such patience (that) when (it is) called upon by hardship (it) runs away.",
                "8": "(O my Lord)! So order clouds of salutations (and blessings which) perpetually (send salutation) from You upon the Prophet (A to fall their rains of salutations upon himA) abundantly and gently.",
                "9": "And upon his (A) family (毓賱賷賴賲 丕賱爻賱丕賲) and his Companions (y), then upon those who follow them, (undoubtedly, they all are) the people of piety, knowledge, mercy and generosity.",
                "10": "(O my Lord)! Then be pleased with Abu Bakr, `Umar, `Ali and `Uthman (y) who are the people of nobility.",
                "11": "(O my Lord)! As long as the easterly breezing makes the branches of cypress rustle (means as long as this world is abide shower Your blessings on the Holy Prophet A) and (as long as) the camel rider make (his) camels march with (his) enchanting (and charming) songs.",
                "12": "(O my Lord)! Forgive its writer and its reader (for the sake of your beloved Prophet A; and) I ask all goodness of You. O (my Lord!) You are the Most Generous and the Most Bountiful.",
                "13": "O (Our) Lord! Fulfill (all of) our (good) objects and forgive us what has passed (in committing sins) for the sake of (Your Beloved Prophet) Mustafa (the chosen one A), O the Most bountiful (and the most generous)."
            }
        }
    },
    "last_updated": "2024-11-22"
}
