{
    "number": 1,
    "source": "dalail-khairat",
    "name": "الْفَصْلُ الْاوَّلُ فِي الْغَزَلِ وَشَكْوَىٰ الْغَرَامِ",
    "latin": null,
    "text": {
        "1": {
            "arabic": "أَمِنْ تَذَكُّرِ جِيرَانٍ بِذِي سَلَمِ۞مَزَجْتَ دَمْعًا جَرَى مِنْ مُقْلَةٍ بِدَمِ",
            "latin": "Amin tadhakkuri jīrānin bi dhī salami۞Mazajta damʿan jarā min muqlatin bidami"
        },
        "2": {
            "arabic": "أَمْ هَبَّتِ الرِّيحُ مِنْ تِلْقَاءِ كَاظِمَةٍ۞وَأَوْمَضَ البَرْقُ فِي الظَّلْمَاءِ مِنْ إِضَمِ",
            "latin": "Am habbatir rīhu min tilqāʾi kādhimatin۞Wa awmaḍal barqu fīẓ ẓulmāʾi min iḍami"
        },
        "3": {
            "arabic": "فَمَا لِعَيْنَيْكَ إِنْ قُلْتَ اكْفُفَا هَمَتَا۞وَمَا لِقَلْبِكَ إِنْ قُلْتَ اسْتَفِقْ يَهِمِ",
            "latin": "Famā li ʿaynayka in qultakfufā hamatā۞Wa mā li qalbika in qultastafiq yahimi"
        },
        "4": {
            "arabic": "أَيَحْسَبُ الصَّبُّ أَنَّ الحُبَّ مُنْكَتِمٌ۞مَا بَيْنَ مُنْسَجِمٍ مِنْهُ وَمُضْطَرِمِ",
            "latin": "Ayaḥsabuṣ ṣabbu annal ḥubba munkatimun۞Mā bayna munsajimin minhu wa muḍṭarimi"
        },
        "5": {
            "arabic": "لَوْلاَ الهَوَى لَمْ تَرِقْ دَمْعًا عَلَى طَلَلٍ۞وَلاَ أَرِقْتَ لِذِكْرِ البَانِ وَالْعَلَمِ",
            "latin": "Lawlal hawā lam turiq damʿan ʿalā ṭalalin۞Wa lā ariqta li dhikril bāni wal ʿalami"
        },
        "6": {
            "arabic": "فَكَيْفَ تُنْكِرُ حُبًّا بَعْدَمَا شَهِدَتْ۞بِهِ عَلَيْكَ عُدُولُ الدَّمْعِ وَالسَّقَمِ",
            "latin": "Fakayfa tunkiru ḥubban baʿda mā shahidat۞Bihi ʿalayka ʿudūlud damʿi was saqami"
        },
        "7": {
            "arabic": "وَأَثْبَتَ الوَجْدُ خَطَّيْ عَبْرَةٍ وَضَنىً۞مِثْلَ البَهَارِ عَلَى خَدَّيْكَ وَالعَنَمِ",
            "latin": "Wa athbatal wajdu khaṭṭay ʿabratin wa ḍanā۞Mithlal bahāri ʿalā khaddayka wal ʿanami"
        },
        "8": {
            "arabic": "نَعَمْ سَرَى طَيْفُ مَنْ أَهْوَى فَأَرَّقَنِي۞وَالحُبُّ يَعْتَرِضُ اللَّذَّاتَ بِالأَلَمِ",
            "latin": "Naʿam sarā ṭayfu man ahwā fa arraqanī۞Wal ḥubbu yaʿtariḍul ladhdhati bil alami"
        },
        "9": {
            "arabic": "يَا لاَئِمِي فِي الهَوَى العُذْرِيِّ مَعْذِرَةً۞مِنِّي إِلَيْكَ وَلَوْ أَنْصَفْتَ لَمْ تَلُمِ",
            "latin": "Yā lāʾimī fīl hawal ʿudhriyyi maʿdhiratan۞Minnī ilayka wa law anṣafta lam talumi"
        },
        "10": {
            "arabic": "عَدَتْكَ حَالِي لاَ سِرِّي بِمُسْتَتِرٍ۞عَنِ الْوُشَاةِ وَلاَ دَائِي بِمُنْحَسِمِ",
            "latin": "ʿAdatka ḥāliya lā sirrī bi mustatirin۞ʿAnil wushāti wa lā dāʾī bimunḥasimi"
        },
        "11": {
            "arabic": "مَحَّضْتَنِي النُصْحَ لَكِنْ لَسْتُ أَسْمَعُهُ۞إِنَّ المُحِبَّ عَنْ العُذَّالِ فِي صَمَمِ",
            "latin": "Maḥḥaḍtanī nuṣḥa lākin lastu asmaʿuhu۞Innal muḥibba ʿanil ʿudhdhāli fī ṣamami"
        },
        "12": {
            "arabic": "إِنِّي اتَّهَمْتُ نَصِيحَ الشَّيْبِ فِي عَذَليِ۞وَالشَّيْبُ أَبْعَدُ فِي نُصْحِ عَنِ التُّهَمِ",
            "latin": "Innit tahamtu naṣīḥash shaybi fī ʿadhalī۞Wash shaybu abʿadu fī nuṣḥin ʿanit tuhami"
        }
    },
    "translations": {
        "en": {
            "name": "Chapter One: Nostalgic Rhapsody and Love Complaint",
            "text": {
                "1": "Is it from remembering neighbours at Dhū SalamThat you shed tears admixed with blood from your eyes?",
                "2": "Or because wind has blown from the direction of KāẓimaAnd lightning has flashed in the dark of Iḍam?",
                "3": "So what ails your eyes that when you tell them ‘stop’, they continue to weep still more?And what ails your heart that when you bid it awake, it wanders further in distraction?",
                "4": "Does the lovelorn man think that love can be hiddenBehind a torrent from his [eyes], or a heart’s raging fire?",
                "5": "But for passion, you would not shed tears at an abandoned camp,Or lie awake at night recalling the fragrant willow or the mountain;",
                "6": "So how can you deny this love when tears and sickness,truthful witnesses, have testified to it against you?",
                "7": "Lovesickness has etched two lines, of tears and gauntness,Upon your cheeks, like yellow spice and red ʿanam",
                "8": "Yes, my beloved’s apparition came to me and denied me sleep,For love always opposes pleasures with pain!",
                "9": "O you who blame me for this chaste love, pardon me!But had you judged fairly, you would not have blamed me.",
                "10": "May you be spared my condition! My secret cannot be concealedFrom detractors, nor is there any cure for my ailment!",
                "11": "You have given me sincere advice, but I cannot hear it;A lover’s ears are deaf to the reproaches of critics.",
                "12": "I hold suspect even the advice of my own grey hairs,Even though their advice is far from deception."
            }
        },
        "id": {
            "name": "",
            "text": {
                "1": "Apakah karena mengingat tetangga tercinta yang berada di Dzu Salamhingga air matamu mengalir deras bercampur darah?",
                "2": "Ataukah karena hembusan angin dari arah Kazhimah,atau kilauan cahaya kilat pada kegelapan dari arah Idham?",
                "3": "Mengapa dengan kedua matamu? Jika engkau menahan air mata, keduanya tetap basah.Ada apa dengan hatimu? Jika kau sadarkan, ia tetap gelisah.",
                "4": "Apakah pemabuk cinta mengira rasa cintanya dapat tersembunyidi balik deraian air mata dan gelora cinta di dada?",
                "5": "Andai bukan karena cinta, air matamu takkan mengalir saat melihat sisa reruntuhan rumah sang kekasihdan tidak pula engkau terjaga untuk mengenang pohon Ban dan bukit yang mengingatkanmu pada sang kekasih.",
                "6": "Bagaimana engkau masih mengingkari rasa cintamu, padahalair mata dan derita telah jujur bersaksi;",
                "7": "Dan derita cintamu telah meninggalkan dua garis bekas linangan air mata dan membuatmu kurus lemah,laksana bunga kuning di kedua pipi dan mawar merah?",
                "8": "Benar! Bayangan kekasihku selalu terlintas dalam benakku hingga membuatku terjaga.Begitulah cinta, dapat mendatangkan derita di balik kenikmatan.",
                "9": "Wahai, para pencelaku karena gelora cinta suci ini! Aku maklumi cacianmu.Seandainya engkau bersikap adil, niscaya kau takkan mencelaku.",
                "10": "Kau telah mengetahui keadaanku. Kini rahasiaku tak dapat tersembunyidari para pemfitnah, sedangkan penyakit yang menimpaku tak kunjung pulih.",
                "11": "Engkau begitu tulus menasihatiku, tapi aku tak pernah mendengarkannya.Sungguh, pecinta selalu tuli untuk mendengar pencaci.",
                "12": "Sungguh, aku telah menuduh nasihat ubanku ikut mencela.Padahal, nasihat uban sangat tulus dan tak layak dicurigai."
            }
        }
    },
    "last_updated": "2024-12-11"
}
