{
    "number": 4,
    "source": "nu-online",
    "name": "الفصل الرابع: في مولده ",
    "latin": null,
    "text": {
        "1": {
            "arabic": "أَبَانَ مَوْلِدُهُ عَنْ طِيْبِ عُنْصُرِهِ ۞ يَا طِيْبَ مُفْتَتَحٍ مِنْهُ وَمُخْتَــــتَمِ",
            "latin": "Abânâ mauliduhu ‘an thîbi ‘unshurihi ۞ yâ thîba muftataḫin minhu wa mukhtatami"
        },
        "2": {
            "arabic": "يَوْمٌ تَفَرَّسَ فِيْـــهِ الفُرْسُ أَنَّهُـــمُو ۞ قَدْ أُنْذِرُوا بِحُلُوْلِ الْبُؤْسِ وَالنِّقَمِ",
            "latin": "Yaumun tafarrasa fîhil-fursu annahumu ۞ qad undzirû biḫulûlil-bu'si wan-niqami"
        },
        "3": {
            "arabic": "وَبَاتَ إِيْوَانُ كِسْرَى وَهْوَ مُنْصَدِعٌ ۞ كَشَمْلِ أَصْحَابِ كِسْرَى غَيْرِ مُلْتَئِمِ",
            "latin": "Wa bâta îwânu kisrâ wahwa munshadi‘i ۞ kasyamli ashḫâbi kisrâ ghairi multa`imi"
        },
        "4": {
            "arabic": "وَالنَّارُ خَامِدَةُ الْأَنْفَاسِ مِنْ أَسَفٍ ۞ عَلَيْهِ وَالنَّهْرُ سَاهِيْ العَيْنِ مِنْ سَدَمِ",
            "latin": "Wan-nâru khâmidatul-anfâsi min asafin ۞ ‘alaihi wan-nahru sâhîl-‘aini min sadami"
        },
        "5": {
            "arabic": "وَسَآءَ سَاوَةَ أَنْ غَاضَتْ بُحَيْرَتُهَا ۞ وَرُدَّ وَارِدُهَا بِالْغَيْظِ حِيْنَ ظَمِيْ",
            "latin": "Wa sâ'a sâwata an ghâdlat buḫairatuhâ ۞ wa rudda wâriduhâ bil-ghaidhi ḫîna dhamî"
        },
        "6": {
            "arabic": "كَأَنَّ بِالنَّارِ مَا بِالْمَـــآءِ مِنْ بَلَلٍ ۞ حُزْنًا وَبِالْمَآءِ مَا بِالنَّارِ مِنْ ضَرَمِ",
            "latin": "Ka 'anna bin-nâri mâ bil-mâ'i min balalin ۞ ḫuznan wa bil-mâ'i mâ bin-nâri min dharami"
        },
        "7": {
            "arabic": "وَالْجِنُّ تَهْتِفُ وَالْأَنْوَارُ سَاطِعَةٌ ۞ وَالْحَقُّ يَظْهَرُ مِنْ مَّعْنًى وَمِنْ كَلِـــمِ",
            "latin": "Wal-jinnu tahtifu wal-anwâru sâthi‘atun ۞ wal-ḫaqqu yadh-haru min ma‘nan wa min kalimi"
        },
        "8": {
            "arabic": "عَمُوْا وَصَمُّوا فَإِعْلَانُ الْبَشَائِرِ لَمْ ۞ تُسْمَعْ وَبَـــارِقَةُ الْإِنْذَارِ لَمْ تُشَمِ",
            "latin": "‘Amû wa shammû fa i‘lânul-basyâ'iri lam ۞ tusma’ wa bâriqatul-indzâri lam tusyami"
        },
        "9": {
            "arabic": "مِنْ بَعْدِ مَا أَخْـــبَرَ الْأَقْوَامَ كَاهِنُهُـــمْ ۞ بِأَنَّ دِيْنَهُمُ الْمُعْوَجَّ لَمْ يَقُـــمِ",
            "latin": "Min ba’di mâ akhbaral-aqwâma kâhinuhum ۞ bi anna dînahumul-mu’awwaju lam yaqumi"
        },
        "10": {
            "arabic": "وَبَعْدَمَا عَايَنُوْا فِيْ الْأُفُقِ مِنْ شُهُبٍ ۞ مُنْقَضَّةٍ وَّفْقَ مَا فِيْ الْأَرْضِ مِنْ صَنَمِ",
            "latin": "Wa ba‘da mâ ‘âyanû fil-ufuqi min syuhubin ۞ munqadldlatin wafqa mâ fil-ardli min shanami"
        },
        "11": {
            "arabic": "حَتَّى غَدَا عَنْ طَرِيقِ الْوَحْيِ مُنْهَزِمٌ ۞ مِنَ الشَّيَاطِيْنِ يَقْفُو إِثْرَ مُنْهَزِمِ",
            "latin": "Ḫattâ ghadâ ‘an tharîqil-waḫyi munhazimun ۞ minasy-syayâthîni yaqfû itsra munhazimi"
        },
        "12": {
            "arabic": "كَأَنَّهُمْ هَرَبًــــا أَبْطَالُ أَبْرَهَـــةٍ ۞ أَوْ عَسْكَرٌ بِالْحَصَى مِنْ رَاحَتَيْهِ رُمِيْ",
            "latin": "Ka'annahum haraban abthâlu abrahatin ۞ au ‘askarun bil-ḫashâ min râḫataihi rumî"
        },
        "13": {
            "arabic": "نَبْذًا بِهِ بَعْدَ تَسْبِيحٍ بِبَطْنِهِمَا ۞ نَبْذَ الْمُسَبِّحِ مِنْ أَحْشَآءِ مُلْتَقِمِ",
            "latin": "Nabdzan bihi ba‘da tasbîhin bibathnihimâ ۞ nabdzal-musabbiḫi min aḫsyâ'i multaqimi"
        }
    },
    "translations": {
        "id": {
            "name": "Bab IV: Kelahiran Rasulullah ﷺ",
            "text": {
                "1": "Kelahiran sang nabi menampakkan kesucian diri. Alangkah indah permulaannya, juga indah penghabisannya",
                "2": "Hari kelahiran Rasulullah saat ada firasat bangsa Persia, bahwa ada peringatan kepada mereka datangnya bencana dan siksa",
                "3": "Saat menjelang malam tiba istana kisra hancur terbelah. Sebagaimana kumpulan sahabat kisra tiada menyatu terpecah belah",
                "4": "Api sesembahan padam karena duka yang mencekam. Sungai Eufrat tak mengalir, muram karena susah yang amat dalam",
                "5": "Penduduk negeri sawah resah duka saat danaunya kering keronta. Pengambil air kembali dengan tangan hampa kecewa ketika terjerat rasa dahaga",
                "6": "Seakan akan pada api nan membara terdapat cairan air karena duka. Dan pada air nan sejuk segar api yang membakar",
                "7": "Para jin menjerit, suara cahaya membumbung ke angkasa. Kebenaran tampak nyata dari makna maupun kata",
                "8": "Mereka buta dan tuli tak dengar hingga kabar gembira tiada didengar. Begitu juga kilatan peringatan sama sekali tak terhiraukan",
                "9": "Para rahib mereka telah kabarkan berita. Bahwa agama mereka melenceng, dan tak kan bertahan lama",
                "10": "Setelah mereka menyaksikan bintang-bintang di ufuk berjatuhan. Bersamaan di bumi ada kejadian berhala-berhala runtuh bergelimpangan",
                "11": "Hingga lenyap syetan berlari terbirit-birit dari pintu langit jalan wahyu ilahi. Mereka lari mengikuti syetan nan berlari tak henti",
                "12": "Mereka berlarian laksana lasykar Raja Abrahah. Atau bak pasukan yang dihujani kerikil oleh tangan Rasul",
                "13": "Batu yang nabi lemparkan, setelah bertasbih dalam genggaman. Bak terlemparnya nabi yunus dari perut ikan paus"
            }
        }
    },
    "last_updated": "2024-11-10"
}
